{
  "schemaVersion": 1,
  "procedureId": "accf",
  "locale": "ja",
  "revision": 1,
  "review": {
    "status": "editorialReviewed",
    "reviewer": "Codex bilingual editorial pass",
    "reviewedAt": "2026-08-02",
    "sourceDigest": "e424fc2b6428b5d7869cb105a566657b6b1f3efa7ea647c98496d31c541367bf"
  },
  "strings": {
    "procedure.title": "前方頸椎椎体切除固定術（ACCF）",
    "procedure.summary": "前方頸椎椎体切除固定術（ACCF）は、1椎間以上の椎間板と椎体を切除して脊髄圧迫を解除する手術です。",
    "step.overview.title": "前方頸椎椎体切除固定術（ACCF）",
    "step.overview.body": "前方頸椎椎体切除固定術（ACCF）は、1椎間以上の椎間板と椎体を切除して脊髄圧迫を解除する手術です。\nこの手術は、**前方頸椎椎間板切除・椎体切除**、**椎体再建**、**前方頸椎固定**の3つの主要な操作から構成されます。\n前方支柱を再建することで、ACCFは有効な除圧と安定化をもたらし、椎体後方へ及ぶ頸椎疾患の治療に有用です。",
    "step.overview.accessibility": "前方頸椎椎体切除固定術（ACCF）. 前方頸椎椎体切除固定術（ACCF）は、1椎間以上の椎間板と椎体を切除して脊髄圧迫を解除する手術です。",
    "step.indications.title": "ACCFの適応",
    "step.indications.body": "ACCFは、病変が椎体の**後方**にあり、椎間板切除だけでは十分に対処できない頸椎疾患に一般的に行われます。\n主な適応には以下があります。\n- **頸椎症性脊髄症**\n- **後縦靱帯骨化症（OPLL）**\n- **頸椎外傷および椎体骨折**\n- **椎体に及ぶ腫瘍**\nこの3Dモデルでは、ヘルニアを起こした椎間板が脊髄を圧迫しています。\n頸椎椎間板ヘルニアは、痛み、しびれ、重症例では上下肢の筋力低下など、さまざまな神経症状を生じ得ます。",
    "step.indications.accessibility": "ACCFの適応. ACCFは、病変が椎体の**後方**にあり、椎間板切除だけでは十分に対処できない頸椎疾患に一般的に行われます。",
    "step.posterior_lesion.title": "頸椎椎体後方の病変",
    "step.posterior_lesion.body": "この矢状断モデルでは頸椎椎間板ヘルニアを示しています。\n図のように、ヘルニア椎間板が椎体の**後方**へ移動し、脊髄を広範に圧迫することがあります。\nヘルニア椎間板のかなりの部分が椎体**後方**に位置するため、このような病変は椎間板切除だけでは除去が困難です。\nこの状況では、椎体を切除することで移動した椎間板片へ**直接到達**し、より完全に除圧できるため、**[前方頸椎椎間板切除固定術（ACDF）](procedure:acdf)**よりACCFが選択されることがあります。",
    "step.posterior_lesion.accessibility": "頸椎椎体後方の病変. この矢状断モデルでは頸椎椎間板ヘルニアを示しています。",
    "step.discectomy_corpectomy.title": "前方頸椎椎間板切除・椎体切除",
    "step.discectomy_corpectomy.body": "ACCFの最初の操作は、罹患した椎間板を除去する**椎間板切除**です。\nしかし、椎間板片が椎体の**後方**に残り、ヘルニア椎間板を完全に切除できない場合があります。\n残存片へ直接到達するため、続いて椎体の大部分を除去する**椎体切除**を行います。\nこれにより椎体**後方**への明瞭な手術経路が得られ、残存椎間板片を完全に除去して十分に除圧できます。",
    "step.discectomy_corpectomy.accessibility": "前方頸椎椎間板切除・椎体切除. ACCFの最初の操作は、罹患した椎間板を除去する**椎間板切除**です。",
    "step.reconstruction.title": "椎体再建",
    "step.reconstruction.body": "十分な除圧を確認した後、脊椎の安定性を回復するために**椎体置換材**を留置します。\n再建方法には以下があります。\n- **献体由来骨移植材**（同種骨）\n- **腸骨移植材**（自家骨）\n- **拡張型椎体ケージ**\nこの3Dモデルでは、切除した椎体を置換するために拡張型ケージを挿入します。\n所定の位置に留置した後、ケージを拡張して脊柱高を回復し、隣接椎体間に安定して適合させます。\n多くの拡張型ケージには、骨がインプラントの**内部**および**周囲**へ成長できる開口部があり、強固な脊椎癒合を促します。",
    "step.reconstruction.accessibility": "椎体再建. 十分な除圧を確認した後、脊椎の安定性を回復するために**椎体置換材**を留置します。",
    "step.anterior_fixation.title": "前方頸椎固定",
    "step.anterior_fixation.body": "再建した脊椎を安定化するため、**プレート**と**スクリュー**を用いて**前方固定**を行います。\nこれらの器具は椎体置換材を固定し、インプラントの移動を防ぎ、骨癒合が進む間の即時的な**機械的安定性**を与えます。\n癒合した椎体分節は独立して動かなくなるため、特に複数椎間で椎間板切除・椎体切除を行うと頸椎可動域が低下することがあります。\n固定後、通常は**画像検査**でプレート、スクリュー、椎体置換デバイスの正しい位置を確認します。",
    "step.anterior_fixation.accessibility": "前方頸椎固定. 再建した脊椎を安定化するため、**プレート**と**スクリュー**を用いて**前方固定**を行います。",
    "step.summary.title": "まとめ",
    "step.summary.body": "ACCFの主な特徴は以下のとおりです。\n- 椎体の**後方**に位置する病変の治療に高い有効性を示します。\n- **椎間板・椎体切除**、**拡張型ケージ留置**、**頸椎プレート固定**の3つの主要な操作から構成されます。\n- 切除した椎体の再建には、**同種骨**、**自家骨**、**拡張型ケージ**などの選択肢があります。\n- 特に**複数椎間**を治療する場合、固定により頸椎可動域が低下することがあります。\nACCFは複雑で侵襲性が高いものの、椎間板切除固定術だけでは十分に治療できない頸椎疾患に対する有効な手術です。",
    "step.summary.accessibility": "まとめ. ACCFの主な特徴は以下のとおりです。"
  }
}
