{
  "schemaVersion": 1,
  "procedureId": "pcdf",
  "locale": "ja",
  "revision": 1,
  "review": {
    "status": "editorialReviewed",
    "reviewer": "Codex bilingual editorial pass",
    "reviewedAt": "2026-08-02",
    "sourceDigest": "666ed756323c3c018460494ded3cec2e2ee0b544918c9cc2ed0df12519b14b9e"
  },
  "strings": {
    "procedure.title": "後方頸椎除圧固定術（PCDF）",
    "procedure.summary": "PCDFは、後方アプローチから脊髄と神経の圧迫を解除する脊椎手術です。",
    "step.overview.title": "後方頸椎除圧固定術（PCDF）",
    "step.overview.body": "PCDFは、後方アプローチから脊髄と神経の圧迫を解除する脊椎手術です。\n**後方頸椎椎弓切除**と**後方頸椎固定**の2つの主要な要素から構成されます。\n脊髄の除圧と安定化を同時に行えるため、PCDFは複雑な脊椎疾患を治療し、患者の生活の質を改善するための有力な手術手技です。",
    "step.overview.accessibility": "後方頸椎除圧固定術（PCDF）. PCDFは、後方アプローチから脊髄と神経の圧迫を解除する脊椎手術です。",
    "step.indications.title": "PCDFの適応",
    "step.indications.body": "PCDFは、保存的治療で症状が改善しない**難治性**の病態に推奨されます。\n主な適応には以下があります。\n- **頸椎症性神経根症および脊髄症**\n- **後縦靱帯骨化症（OPLL）**\n- **先天性変形**\n- **腫瘍**\nこの3Dモデルでは、C5椎弓の**骨性過形成**を示しています。\nこの病変は脊髄と神経を圧迫し、痛み、上肢の感覚障害、重症例では四肢麻痺を含むさまざまな神経症状を引き起こし得ます。",
    "step.indications.accessibility": "PCDFの適応. PCDFは、保存的治療で症状が改善しない**難治性**の病態に推奨されます。",
    "step.laminectomy.title": "後方頸椎椎弓切除",
    "step.laminectomy.body": "後方頸椎椎弓切除はPCDFの基本的な操作で、通常は手術の**早期**に行います。\nこの操作では、脊髄を屋根のように覆う骨構造である**椎弓**を切除します。椎弓を切除すると脊柱管が拡大し、原因病変による脊髄圧迫が解除されます。\n椎弓切除により脊髄が露出しても、**傍脊柱筋**や**脂肪組織**など周囲の軟部組織が脊髄を覆って構造的に支持し、直接損傷のリスクを軽減します。",
    "step.laminectomy.accessibility": "後方頸椎椎弓切除. 後方頸椎椎弓切除はPCDFの基本的な操作で、通常は手術の**早期**に行います。",
    "step.post_laminectomy_kyphosis.title": "椎弓切除後後弯",
    "step.post_laminectomy_kyphosis.body": "椎弓切除には利点と限界があります。\n脊髄除圧に有効である一方、**椎弓切除後後弯**のリスクがあります。\n椎弓切除後後弯は、正常な頸椎前弯が失われ、頸部が**前方へ傾く**重大な術後脊椎合併症です。\n椎弓切除で**靱帯複合体**や**傍脊柱筋群**などの後方支持組織が剥離されるため、この変形が生じます。\n椎弓切除後後弯は脊髄の張力を増大させ、神経症状を**悪化**させる可能性があります。",
    "step.post_laminectomy_kyphosis.accessibility": "椎弓切除後後弯. 椎弓切除には利点と限界があります。",
    "step.posterior_fixation.title": "後方頸椎固定",
    "step.posterior_fixation.body": "椎弓切除後後弯のリスクを減らすため、**後方頸椎固定**を行うことがあります。\nこの手術では、脊椎後方要素に沿って**スクリュー**と**ロッド**を設置し、**機械的支持**を与えます。\n具体的には、前方・後方脊柱をつなぐ支持構造である椎骨の**外側塊**へスクリューを挿入します。\n使用するスクリュー数は、病変範囲と除圧が必要な椎体レベル数により異なります。\n続いてロッドで複数椎間のスクリューを連結し、強固な固定と適切なアライメントを得ます。\nこの手術の欠点の一つは**可動域**の低下です。\nインプラントが強固に安定化するため、分節運動は**制限**されます。\n病変のない非固定椎間では、ある程度の頸部運動が保たれる場合があります。",
    "step.posterior_fixation.accessibility": "後方頸椎固定. 椎弓切除後後弯のリスクを減らすため、**後方頸椎固定**を行うことがあります。",
    "step.summary.title": "まとめ",
    "step.summary.body": "PCDFの主な要点は以下のとおりです。\n- **後方頸椎椎弓切除**と**後方頸椎固定**の両方を行います。\n- 保存的治療に**抵抗性**の圧迫性疾患に有効です。\n- **椎弓切除後後弯**や**可動域低下**などの術後合併症を生じることがあります。\n合併症の可能性はあるものの、PCDFは確実な脊髄除圧と病変に対する安定性をもたらす有効な手術です。",
    "step.summary.accessibility": "まとめ. PCDFの主な要点は以下のとおりです。"
  }
}
