{
  "schemaVersion": 1,
  "procedureId": "acdf",
  "locale": "ja",
  "revision": 1,
  "review": {
    "status": "editorialReviewed",
    "reviewer": "Codex bilingual editorial pass",
    "reviewedAt": "2026-08-02",
    "sourceDigest": "0cb0ba7b09f0acd09578692cee2f9c06932a98d18d3c78e840e04b5c4a641535"
  },
  "strings": {
    "procedure.title": "前方頸椎椎間板切除固定術（ACDF）",
    "procedure.summary": "前方頸椎椎間板切除固定術（ACDF）は、脊髄の圧迫を解除し、頸椎を安定化することを目的とする手術です。",
    "step.overview.title": "前方頸椎椎間板切除固定術（ACDF）",
    "step.overview.body": "前方頸椎椎間板切除固定術（ACDF）は、脊髄の圧迫を解除し、頸椎を安定化することを目的とする手術です。\nACDFは、**前方頸椎椎間板切除**、**椎体間ケージ留置**、**前方頸椎固定**の3つの主要な操作から構成されます。\n**[後方頸椎除圧固定術（PCDF）](procedure:pcdf)**と比べ、ACDFでは頸部前面の小切開から頸椎へ到達する前方アプローチを用います。\nこのアプローチにより、ACDFは頸椎の**前方構造**に関わる病変の治療に特に適しています。",
    "step.overview.accessibility": "前方頸椎椎間板切除固定術（ACDF）. 前方頸椎椎間板切除固定術（ACDF）は、脊髄の圧迫を解除し、頸椎を安定化することを目的とする手術です。",
    "step.indications.title": "ACDFの適応",
    "step.indications.body": "ACDFは、頸椎の**前方**に関わる病変の治療で一般的に行われます。\n主な適応には以下があります。\n- **頸椎症性神経根症**および**脊髄症**\n- **椎間板変性症**\n- **腹側**骨棘形成を伴う**頸椎症**\n- **頸椎アライメント不良**\nこの3Dモデルでは、脊髄の前方からの圧迫を示しています。\n具体的には、頸髄症を伴うC4–C5椎間板ヘルニアを描いています。\nこれは、後方アプローチよりACDFが選択され得る典型的な臨床状況であり、前方の手術経路から直接除圧できます。",
    "step.indications.accessibility": "ACDFの適応. ACDFは、頸椎の**前方**に関わる病変の治療で一般的に行われます。",
    "step.discectomy.title": "前方頸椎椎間板切除",
    "step.discectomy.body": "ACDFの最初の操作は、損傷した椎間板を除去する**椎間板切除**です。\n椎間板は椎骨の間にある、柔らかいクッション状の構造です。\n衝撃を吸収し、脊椎が運動や機械的負荷に耐えるのを助けます。\n椎間板ヘルニアでは、椎間板の一部が外側へ突出し、**脊髄**または**近傍の神経**を圧迫します。\nこの圧迫により、頸部痛、上肢の筋力低下・しびれ・異常感覚、平衡や協調運動の障害などが生じることがあります。\nヘルニア椎間板を除去することで、脊髄と神経への圧迫を解除し、これらの症状の改善が期待できます。\n椎間板を除去すると、**骨棘**など他の圧迫構造へ直接到達して切除することも可能になります。",
    "step.discectomy.accessibility": "前方頸椎椎間板切除. ACDFの最初の操作は、損傷した椎間板を除去する**椎間板切除**です。",
    "step.cage_types.title": "椎体間ケージの種類",
    "step.cage_types.body": "椎間板切除後、除去した椎間板腔を満たすために**椎体間ケージ**を留置します。\n椎体間ケージには、次のようなさまざまな材料があります。\n- ポリエーテルエーテルケトン（PEEK）などの耐久性に優れた**医療用プラスチック**\n- **多孔質チタン**\n- **構造的骨移植材**（同種骨または自家骨）\n多くの場合、ケージの材質は手術**前**に選択します。\n一方、ケージのサイズは通常、手術**中**に決定します。\n椎間板切除の完了後、術者は除去した椎間板を適切に置換できるケージのサイズを実際に計測・試験して選びます。",
    "step.cage_types.accessibility": "椎体間ケージの種類. 椎間板切除後、除去した椎間板腔を満たすために**椎体間ケージ**を留置します。",
    "step.cage_implantation.title": "椎体間ケージ留置",
    "step.cage_implantation.body": "椎体間ケージのサイズを決定したら、椎間板を除去した正確な位置へ挿入します。\nこの器具の役割は、**椎間高**と頸椎の**アライメント**を回復し、**骨癒合の足場**を提供することです。\n椎体間ケージは、時間の経過とともに新生骨がインプラントの**内部**または**周囲**へ成長し、隣接椎骨を一つの安定した骨として連結するよう設計されています。\nまた、骨癒合が完成するまで、日常生活で頸部に加わる**力に耐える**よう設計されています。",
    "step.cage_implantation.accessibility": "椎体間ケージ留置. 椎体間ケージのサイズを決定したら、椎間板を除去した正確な位置へ挿入します。",
    "step.anterior_fixation.title": "前方頸椎固定",
    "step.anterior_fixation.body": "椎体の骨癒合には、手術範囲、併存疾患、その他の要因により**6〜12か月**かかることがあります。\n椎骨が一つの強固な骨として癒合するまで、**頸椎プレート固定**を行うことがあります。\nこの操作では、通常**チタン**製の小さな金属プレートを**スクリュー**で椎体前面に固定します。\nプレートは内固定具として働き、骨癒合中に椎骨と椎体間ケージを正しい位置に保ちます。\n脊椎疾患の範囲に応じて、プレートは1椎間または複数椎間に及ぶことがあります。\n多くの場合、プレートとスクリューは**永久的**に体内へ残すことを前提としています。",
    "step.anterior_fixation.accessibility": "前方頸椎固定. 椎体の骨癒合には、手術範囲、併存疾患、その他の要因により**6〜12か月**かかることがあります。",
    "step.summary.title": "まとめ",
    "step.summary.body": "ACDFの主な特徴は以下のとおりです。\n- **前方頸椎椎間板切除**、**椎体間ケージ留置**、**前方頸椎固定**から構成されます。\n- 脊椎の**前方**に影響する疾患の治療に高い有効性を示します。\n- **椎体間ケージ**と**骨移植材**を用いて隣接椎体間の骨癒合を促します。\n- プレートとスクリューは、骨癒合後も通常**永久的**に留置されます。\nこれらの利点から、ACDFは脊髄・神経の圧迫を解除しながら頸椎に長期的な安定性を与える手術として広く行われています。",
    "step.summary.accessibility": "まとめ. ACDFの主な特徴は以下のとおりです。"
  }
}
